CRS,2012001219-6,,915,Asian Development Bank,,1,Asian Development Bank,https://www.adb.org/,https://www.adb.org/projects,Bukidnon Irrigation,Short: BUKIDNON IRRIGATION Long: ,LN0406-PHI,Philippines,,0,"USD, constant 2021",2012,3,755,10008,Far East Asia,10018,LMICs,13,ODA Loans,4,10,421,C01,,,.787319,,,.81317598,,,,,,,,,,,,,302,,,,,BUKIDNON IRRIGATION,99810,Sectors not specified,998,IX. Unallocated / Unspecified,12000,Recipient Government,,12000,,,,1979-11-26,1989-05-04,,,,,,,,,,,,,,,,,,,,,5,2,"01000 , 01000",,1989-08-01,2019-02-01,.063274004,5.1434612,,,,,,,,CRS 2012 data,74345783296,1,0,1,0,1,1,,629637824,1
CRS,2011001027-6,,915,Asian Development Bank,,1,Asian Development Bank,https://www.adb.org/,https://www.adb.org/projects,Bukidnon Irrigation,"Short: BUKIDNON IRRIGATION Long: Product type: ADF - CONVERTED TO SDR. . AsDB internal sector description: Irrigation, Drainage, and Flood Protection.",LN0406-PHI(SF),Philippines,,0,"USD, constant 2021",2011,3,755,10008,Far East Asia,10018,LMICs,13,ODA Loans,4,10,421,C01,,,.817132,,,.82408601,,,,,,,,,,,,,302,,,,,BUKIDNON IRRIGATION,31140,Agricultural water resources,311,III.1.a. Agriculture,12000,Recipient Government,,12000,,,,1979-11-26,1989-05-04,"Product type: ADF - CONVERTED TO SDR. . AsDB internal sector description: Irrigation, Drainage, and Flood Protection.",,,,,,,,,,,,,,,,,,,,5,2,"01000 , 01000",1000,1989-08-01,2019-02-01,.074410997,5.9286032,0,0,,,,,,CRS 2011 data,74345783296,1,1,1,1,1,1,,629637824,0
CRS,2012001239-6,,915,Asian Development Bank,,1,Asian Development Bank,https://www.adb.org/,https://www.adb.org/projects,Second Laguna De Bay Irrigation,Short: SECOND LAGUNA DE BAY IRRIGATION Long: ,LN0466-PHI,Philippines,,0,"USD, constant 2021",2012,3,755,10008,Far East Asia,10018,LMICs,13,ODA Loans,4,10,421,C01,,,.71222597,,,.73561698,,,,,,,,,,,,,302,,,,,SECOND LAGUNA DE BAY IRRIGATION,99810,Sectors not specified,998,IX. Unallocated / Unspecified,12000,Recipient Government,,12000,,,,1981-04-28,1991-10-31,,,,,,,,,,,,,,,,,,,,,5,2,"01000 , 01000",,1991-03-15,2020-09-15,.049943998,5.6935568,,,,,,,,CRS 2012 data,74345783296,1,0,1,0,1,1,,629637824,1
CRS,2011001047-6,,915,Asian Development Bank,,1,Asian Development Bank,https://www.adb.org/,https://www.adb.org/projects,Second Laguna De Bay Irrigation,"Short: SECOND LAGUNA DE BAY IRRIGATION Long: Product type: ADF - CONVERTED TO SDR. . AsDB internal sector description: Irrigation, Drainage, and Flood Protection.",LN0466-PHI(SF),Philippines,,0,"USD, constant 2021",2011,3,755,10008,Far East Asia,10018,LMICs,13,ODA Loans,4,10,421,C01,,,.72675198,,,.73293799,,,,,,,,,,,,,302,,,,,SECOND LAGUNA DE BAY IRRIGATION,31140,Agricultural water resources,311,III.1.a. Agriculture,12000,Recipient Government,,12000,,,,1981-04-28,1991-10-31,"Product type: ADF - CONVERTED TO SDR. . AsDB internal sector description: Irrigation, Drainage, and Flood Protection.",,,,,,,,,,,,,,,,,,,,5,2,"01000 , 01000",1000,1991-03-15,2020-09-15,.078230001,6.3982749,0,0,,,,,,CRS 2011 data,74345783296,1,1,1,1,1,1,,629637824,0
CRS,2012000338,,915,Asian Development Bank,,1,Asian Development Bank,https://www.adb.org/,https://www.adb.org/projects,IRRIGATION SECTOR PROJECT,Short: IRRIGATION SECTOR PROJECT Long: ,LN0667-PHI,Philippines,,0,"USD, constant 2021",2012,3,755,10008,Far East Asia,10018,LMICs,14,Other Official Flows (non Export Credit),4,21,421,C01,,,5.3358078,,,5.511045,,,,,,,,,,,,,302,,,,,IRRIGATION SECTOR PROJECT,99810,Sectors not specified,998,IX. Unallocated / Unspecified,12000,Recipient Government,,12000,,,,1984-06-22,1993-04-06,,,,,,,,,,,,,,,,,,,,,2,2,10500,,1990-05-15,2013-11-15,1.044421,5.684577,,,,,,,,CRS 2012 data,74345783296,1,0,1,0,1,1,,629637824,0
CRS,2012000366,,915,Asian Development Bank,,1,Asian Development Bank,https://www.adb.org/,https://www.adb.org/projects,IRRIGATION SYSTEMS IMPROVEMENT PROJECT,Short: IRRIGATION SYSTEMS IMPROVEMENT PROJECT Long: ,LN1048-PHI,Philippines,,0,"USD, constant 2021",2012,3,755,10008,Far East Asia,10018,LMICs,14,Other Official Flows (non Export Credit),4,21,421,C01,,,.83792001,,,.865439,,,,,,,,,,,,,302,,,,,IRRIGATION SYSTEMS IMPROVEMENT PROJECT,99810,Sectors not specified,998,IX. Unallocated / Unspecified,12000,Recipient Government,,12000,,,,1991-03-22,1998-03-30,,,,,,,,,,,,,,,,,,,,,2,2,1260,600,1996-05-15,2015-11-15,.059579998,2.8435371,,,,,,,,CRS 2012 data,74345783296,1,0,1,0,1,1,,629637824,0
CRS,2012001502-6,,915,Asian Development Bank,,1,Asian Development Bank,https://www.adb.org/,https://www.adb.org/projects,Irrigation Systems Improvement Project,Short: IRRIGATION SYSTEMS IMPROVEMENT PROJECT Long: ,LN1049-PHI,Philippines,,0,"USD, constant 2021",2012,3,755,10008,Far East Asia,10018,LMICs,13,ODA Loans,4,10,421,C01,,,1.044962,,,1.07928,,,,,,,,,,,,,302,,,,,IRRIGATION SYSTEMS IMPROVEMENT PROJECT,99810,Sectors not specified,998,IX. Unallocated / Unspecified,12000,Recipient Government,,12000,,,,1991-03-22,1998-06-04,,,,,,,,,,,,,,,,,,,,,5,2,"01000 , 01000",,2001-05-15,2025-11-15,.146016,13.628256,,,,,,,,CRS 2012 data,74345783296,1,0,1,0,1,1,,629637824,1
CRS,2011001310-6,,915,Asian Development Bank,,1,Asian Development Bank,https://www.adb.org/,https://www.adb.org/projects,Irrigation Systems Improvement Project,"Short: IRRIGATION SYSTEMS IMPROVEMENT PROJECT Long: Product type: ADF - CONVERTED TO SDR. . AsDB internal sector description: Irrigation, Drainage, and Flood Protection.",LN1049-PHI(SF),Philippines,,0,"USD, constant 2021",2011,3,755,10008,Far East Asia,10018,LMICs,13,ODA Loans,4,10,421,C01,,,1.080251,,,1.089444,,,,,,,,,,,,,302,,,,,IRRIGATION SYSTEMS IMPROVEMENT PROJECT,31140,Agricultural water resources,311,III.1.a. Agriculture,12000,Recipient Government,,12000,,,,1991-03-22,1998-06-04,"Product type: ADF - CONVERTED TO SDR. . AsDB internal sector description: Irrigation, Drainage, and Flood Protection.",,,,,,,,,,,,,,,,,,,,5,2,"01000 , 01000",1000,2001-05-15,2025-11-15,.171057,14.660679,0,0,,,,,,CRS 2011 data,74345783296,1,1,1,1,1,1,,629637824,0
CRS,2012001542-6,,915,Asian Development Bank,,1,Asian Development Bank,https://www.adb.org/,https://www.adb.org/projects,Kabulnan Irrigation & Area Development Project,Short: KABULNAN IRRIGATION & AREA DEVELOPMENT PROJECT Long: ,LN1136-PHI,Philippines,,0,"USD, constant 2021",2012,3,755,10008,Far East Asia,10018,LMICs,13,ODA Loans,4,10,421,C01,,,2.4040251,,,2.4829769,,,,,,,,,,,,,302,,,,,KABULNAN IRRIGATION & AREA DEVELOPMENT PROJECT,99810,Sectors not specified,998,IX. Unallocated / Unspecified,12000,Recipient Government,,12000,,,,1992-03-04,2002-04-23,,,,,,,,,,,,,,,,,,,,,5,2,"01000 , 01000",,2002-05-15,2026-11-15,.36082,33.760628,,,,,,,,CRS 2012 data,74345783296,1,0,1,0,1,1,,629637824,1
CRS,2011001350-6,,915,Asian Development Bank,,1,Asian Development Bank,https://www.adb.org/,https://www.adb.org/projects,Kabulnan Irrigation & Area Development Project,"Short: KABULNAN IRRIGATION & AREA DEVELOPMENT PROJECT Long: Product type: ADF - CONVERTED TO SDR. . AsDB internal sector description: Irrigation, Drainage, and Flood Protection.",LN1136-PHI(SF),Philippines,,0,"USD, constant 2021",2011,3,755,10008,Far East Asia,10018,LMICs,13,ODA Loans,4,10,421,C01,,,1.242763,,,1.25334,,,,,,,,,,,,,302,,,,,KABULNAN IRRIGATION & AREA DEVELOPMENT PROJECT,31140,Agricultural water resources,311,III.1.a. Agriculture,12000,Recipient Government,,12000,,,,1992-03-04,2002-04-23,"Product type: ADF - CONVERTED TO SDR. . AsDB internal sector description: Irrigation, Drainage, and Flood Protection.",,,,,,,,,,,,,,,,,,,,5,2,"01000 , 01000",1000,2002-05-15,2026-11-15,.40860501,36.133221,0,0,,,,,,CRS 2011 data,74345783296,1,1,1,1,1,1,,629637824,0
CRS,2012000432,,915,Asian Development Bank,,1,Asian Development Bank,https://www.adb.org/,https://www.adb.org/projects,SECOND IRRIGATION SYSTEMS IMPROVEMENT PROJECT,Short: SECOND IRRIGATION SYSTEMS IMPROVEMENT PROJECT Long: ,LN1365-PHI,Philippines,,0,"USD, constant 2021",2012,3,755,10008,Far East Asia,10018,LMICs,14,Other Official Flows (non Export Credit),4,21,421,C01,,,.3425,,,.35374799,,,,,,,,,,,,,302,,,,,SECOND IRRIGATION SYSTEMS IMPROVEMENT PROJECT,99810,Sectors not specified,998,IX. Unallocated / Unspecified,12000,Recipient Government,,12000,,,,1997-03-31,2006-04-18,,,,,,,,,,,,,,,,,,,,,2,2,4330,600,2002-11-15,2022-05-15,.25264999,5.6255059,,,,,,,,CRS 2012 data,74345783296,1,0,1,0,1,1,,629637824,1
CRS,2012001657-6,,915,Asian Development Bank,,1,Asian Development Bank,https://www.adb.org/,https://www.adb.org/projects,Second Irrigation Systems Improvement Project,Short: SECOND IRRIGATION SYSTEMS IMPROVEMENT PROJECT Long: ,LN1366-PHI,Philippines,,0,"USD, constant 2021",2012,3,755,10008,Far East Asia,10018,LMICs,13,ODA Loans,4,10,421,C01,,,.35730901,,,.36904401,,,,,,,,,,,,,302,,,,,SECOND IRRIGATION SYSTEMS IMPROVEMENT PROJECT,99810,Sectors not specified,998,IX. Unallocated / Unspecified,12000,Recipient Government,,12000,,,,1997-03-31,2006-04-11,,,,,,,,,,,,,,,,,,,,,5,2,"01000 , 01000",,2005-11-15,2030-05-15,.119749,11.649931,,,,,,,,CRS 2012 data,74345783296,1,0,1,0,1,1,,629637824,1
CRS,2011001465-6,,915,Asian Development Bank,,1,Asian Development Bank,https://www.adb.org/,https://www.adb.org/projects,Second Irrigation Systems Improvement Project,"Short: SECOND IRRIGATION SYSTEMS IMPROVEMENT PROJECT Long: Product type: ADF - CONVERTED TO SDR. . AsDB internal sector description: Irrigation, Drainage, and Flood Protection.",LN1366-PHI(SF),Philippines,,0,"USD, constant 2021",2011,3,755,10008,Far East Asia,10018,LMICs,13,ODA Loans,4,10,421,C01,,,.369376,,,.37252,,,,,,,,,,,,,302,,,,,SECOND IRRIGATION SYSTEMS IMPROVEMENT PROJECT,31140,Agricultural water resources,311,III.1.a. Agriculture,12000,Recipient Government,,12000,,,,1997-03-31,2006-04-11,"Product type: ADF - CONVERTED TO SDR. . AsDB internal sector description: Irrigation, Drainage, and Flood Protection.",,,,,,,,,,,,,,,,,,,,5,2,"01000 , 01000",1000,2005-11-15,2030-05-15,.13461301,11.995449,0,0,,,,,,CRS 2011 data,74345783296,1,1,1,1,1,1,,629637824,0
CRS,2018000074,,915,Asian Development Bank,,1,Asian Development Bank,https://www.adb.org/,https://www.adb.org/projects,Agrarian Reform Communities,"Short: AGRARIAN REFORM COMMUNITIES Long: The Project will increase the income of Agrarian Reform Beneficiaries (ARBs), improve their quality of life by providing basic infrastructure and development support services, and increase agricultural production. Out of 984 Agrarian Reform Communities (ARCs) nationwide, the Project will assist about 140 ARCs, selected on the basis of comprehensive criteria. The Project has four components: (a) Rural Infrastructure which includes access infrastructure (roads, bridges, etc., communal irrigation, and potable water supply, (b) Land Survey for about 100,000 ha public lands, (c) Development Support Services, namely, for Agriculture, Rural Enterprise, Community and Institutional Development. In addition, credit will be provided by the Land Bank of the Philippines (LBP) from its own resources for agricultural production and enterprise investments, and (d) Project Management and Capacity Building.",LN1667-PHI,Philippines,2019,0,"USD, constant 2021",2019,8,755,10008,Far East Asia,10018,LMICs,14,Other Official Flows (non Export Credit),4,21,421,C01,0,0,4.1739998,0,0,4.5697699,,,,,,,,,,,,,302,0,0,,,AGRARIAN REFORM COMMUNITIES,31110,Agricultural policy and administrative management,311,III.1.a. Agriculture,12000,Recipient Government,Department of Agrarian Reform,12000,,,,,,"The Project will increase the income of Agrarian Reform Beneficiaries (ARBs), improve their quality of life by providing basic infrastructure and development support services, and increase agricultural production. Out of 984 Agrarian Reform Communities (ARCs) nationwide, the Project will assist about 140 ARCs, selected on the basis of comprehensive criteria. The Project has four components: (a) Rural Infrastructure which includes access infrastructure (roads, bridges, etc., communal irrigation, and potable water supply, (b) Land Survey for about 100,000 ha public lands, (c) Development Support Services, namely, for Agriculture, Rural Enterprise, Community and Institutional Development. In addition, credit will be provided by the Land Bank of the Philippines (LBP) from its own resources for agricultural production and enterprise investments, and (d) Project Management and Capacity Building.",,,,,,,,,,,,,,,,,,,2019-12-31,,,,,,,,,,,,,,,,CRS 2019 data,74345783296,0,1,0,0,1,1,0,629637824,1
CRS,2012000554,,915,Asian Development Bank,,1,Asian Development Bank,https://www.adb.org/,https://www.adb.org/projects,SOUTHERN PHILIPPINES IRRIGATION SECTOR PROJECT,Short: SOUTHERN PHILIPPINES IRRIGATION SECTOR PROJECT Long: ,LN1668-PHI,Philippines,,0,"USD, constant 2021",2012,3,755,10008,Far East Asia,10018,LMICs,14,Other Official Flows (non Export Credit),4,21,421,C01,,,.3382,,,.349307,,,,,,,,,,,,,302,,,,,SOUTHERN PHILIPPINES IRRIGATION SECTOR PROJECT,99810,Sectors not specified,998,IX. Unallocated / Unspecified,12000,Recipient Government,,12000,,,,1999-10-29,2011-06-30,,,,,,,,,,,,,,,,,,,,,2,2,4330,600,2006-02-15,2023-08-15,.311665,7.002779,,,,,,,,CRS 2012 data,74345783296,1,0,1,0,1,1,,629637824,1
CRS,2014000210,,915,Asian Development Bank,,1,Asian Development Bank,https://www.adb.org/,https://www.adb.org/projects,GRAINS SECTOR DEVELOPMENT PROJECT,"Short: GRAINS SECTOR DEVELOPMENT PROJECT Long: The primary goals of the Grain Sector Development Program (GSDP) are to attain sustained growth in grains productivity and grains households' income, reduce the level of rural poverty, and achieve a more cost-effective resource efficient food security through: (i) improving the existing grains policy regime, (ii) strengthening the institutional capacity in providing support services to the grains sector, and (iii) attaining a policy and institutional environment that attracts private sector investments at all levels of the grain production and marketing chain and ensures food security. The Program comprises (i) a policy program (to be supported by ADB's program loan) that will enable policy and institutional reforms and ensure increased sector investments in infrastructure facilities, and (ii) an investment project (to be supported by ADB's investment loan) that will provide for improvements in irrigation infrastructure for grains, strengthening grains technology generation and dissemination, capacity building for the EA, and support for project management. GSDP will be accompanied by four advisory technical assistance (TA) projects, one of which will be financed by the Bank to provide policy analysis and advocacy support to the EA in ensuring timely compliance and fulfillment of the critical reforms required by the grains sector. The other three TAs are being financed by the United States Agency for International Development. (Piggybacked to this loan is the Grains Production Improvement technical assistance).",LN1740-PHI,Philippines,2000,0,"USD, constant 2021",2014,3,755,10008,Far East Asia,10018,LMICs,14,Other Official Flows (non Export Credit),4,21,421,C01,0,0,.071828,0,0,.073310003,,,,,,,,,,,,,302,0,0,,,GRAINS SECTOR DEVELOPMENT PROJECT,99810,Sectors not specified,998,IX. Unallocated / Unspecified,12000,Recipient Government,,12000,,,,2000-08-11,2004-06-08,"The primary goals of the Grain Sector Development Program (GSDP) are to attain sustained growth in grains productivity and grains households' income, reduce the level of rural poverty, and achieve a more cost-effective resource efficient food security through: (i) improving the existing grains policy regime, (ii) strengthening the institutional capacity in providing support services to the grains sector, and (iii) attaining a policy and institutional environment that attracts private sector investments at all levels of the grain production and marketing chain and ensures food security. The Program comprises (i) a policy program (to be supported by ADB's program loan) that will enable policy and institutional reforms and ensure increased sector investments in infrastructure facilities, and (ii) an investment project (to be supported by ADB's investment loan) that will provide for improvements in irrigation infrastructure for grains, strengthening grains technology generation and dissemination, capacity building for the EA, and support for project management. GSDP will be accompanied by four advisory technical assistance (TA) projects, one of which will be financed by the Bank to provide policy analysis and advocacy support to the EA in ensuring timely compliance and fulfillment of the critical reforms required by the grains sector. The other three TAs are being financed by the United States Agency for International Development. (Piggybacked to this loan is the Grains Production Improvement technical assistance).",,,,,,,,,,,,,,,,,,,2000-07-18,2,2,5170,600,2005-02-15,2024-08-15,0,0,,,,,,,,CRS 2014 data,74345783296,0,1,0,0,1,1,0,629637824,1
CRS,2013000651,,915,Asian Development Bank,,1,Asian Development Bank,https://www.adb.org/,https://www.adb.org/projects,Agrarian Reform Communities Project  II,"Short: AGRARIAN REFORM COMMUNITIES PROJECT  II Long: Product type: LIBOR BASED LOAN.     The Project will support the Government's Medium Term Philippine Development Plan (MTPDP) 2005-1010. It will pursue a holistic approach to poverty reduction by promoting an agribusiness approach to rural development. It will assist the implementation of the Comprehensive Agrarian Reform Program (CARP) by addressing the most pressing requirements for support in 152 agrarian reform communities (ARCs) and ARC Clusters in 19 provinces in southern Philippines.   The long-term impact of the Project is to enable ARB households and other sections of the rural poor in approximately 152 selected ARCs and ARC Clusters (ARC Clusters will include target ARCs and ARBs and other farmers in adjacent areas) in 19 provinces (the provinces to be covered include Romblon, Marinduque, Camarines Norte, Camarines Sur, Sorsogon, Negros Oriental, Leyte, Eastern Samar, Northern Samar, Western Samar, Zamboanga del Norte, Zamboanga del Sur, Zamboanga Sibugay, Shariff Kabunsuan, Maguindanao, Lanao Del Sur, Tawi Tawi, Basilan, and Sulu) to reduce their poverty, and have sustained improvements in their incomes and quality of life. In order to achieve these impacts, the Project is expected to bring about long lasting improvements in the capabilities and well being of poor and marginalized groups in the target communities. In order to achieve the above outcomes of poverty reduction and sustainable livelihoods, the Project will support the following outputs: (i) strong participation of local communities in the development process by the (a) enhancement of social capital among target communities through the use of a CDD approach, (b) detailed participatory ARC planning based on participation by the rural poor, as well as (c) improved capacity of ARC organizations and LGUs, for better governance and convergence in the provision of support services to target communities, (ii) agri enterprise development (AED)including (a) transfer of technology, (b) greater entrepreneurship among ARC organizations, (c) linkages between the private sector and corporate entities and ARC organizations, for increased investments into rural areas for growth, (d) wider prevalence of community based savings and lending groups for setting up sustainable micro-finance services among communities, (e)  Land Tenure Improvement to improve security of land titles, enable investments into productivity enhancements, (iii) improved access to rural infrastructure, designed to provide a boost to improved production and productivity, and crop intensification, and (iv) improved project management.",LN2465-PHI,Philippines,2008,0,"USD, constant 2021",2013,3,755,10008,Far East Asia,10018,LMICs,14,Other Official Flows (non Export Credit),4,21,421,C01,,1.444,,,1.477796,,,,,,,,,,,,,,302,,1.444,,,AGRARIAN REFORM COMMUNITIES PROJECT  II,31140,Agricultural water resources,311,III.1.a. Agriculture,12000,Recipient Government,,12000,,,,2009-03-04,2015-06-30,"Product type: LIBOR BASED LOAN.     The Project will support the Government's Medium Term Philippine Development Plan (MTPDP) 2005-1010. It will pursue a holistic approach to poverty reduction by promoting an agribusiness approach to rural development. It will assist the implementation of the Comprehensive Agrarian Reform Program (CARP) by addressing the most pressing requirements for support in 152 agrarian reform communities (ARCs) and ARC Clusters in 19 provinces in southern Philippines.   The long-term impact of the Project is to enable ARB households and other sections of the rural poor in approximately 152 selected ARCs and ARC Clusters (ARC Clusters will include target ARCs and ARBs and other farmers in adjacent areas) in 19 provinces (the provinces to be covered include Romblon, Marinduque, Camarines Norte, Camarines Sur, Sorsogon, Negros Oriental, Leyte, Eastern Samar, Northern Samar, Western Samar, Zamboanga del Norte, Zamboanga del Sur, Zamboanga Sibugay, Shariff Kabunsuan, Maguindanao, Lanao Del Sur, Tawi Tawi, Basilan, and Sulu) to reduce their poverty, and have sustained improvements in their incomes and quality of life. In order to achieve these impacts, the Project is expected to bring about long lasting improvements in the capabilities and well being of poor and marginalized groups in the target communities. In order to achieve the above outcomes of poverty reduction and sustainable livelihoods, the Project will support the following outputs: (i) strong participation of local communities in the development process by the (a) enhancement of social capital among target communities through the use of a CDD approach, (b) detailed participatory ARC planning based on participation by the rural poor, as well as (c) improved capacity of ARC organizations and LGUs, for better governance and convergence in the provision of support services to target communities, (ii) agri enterprise development (AED)including (a) transfer of technology, (b) greater entrepreneurship among ARC organizations, (c) linkages between the private sector and corporate entities and ARC organizations, for increased investments into rural areas for growth, (d) wider prevalence of community based savings and lending groups for setting up sustainable micro-finance services among communities, (e)  Land Tenure Improvement to improve security of land titles, enable investments into productivity enhancements, (iii) improved access to rural infrastructure, designed to provide a boost to improved production and productivity, and crop intensification, and (iv) improved project management.",,,,,,,,,,,,,,,,,,,2008-12-08,2,2,355,200,2015-05-15,2033-11-15,,,,,,,,,,CRS 2013 data,74345783296,0,0,0,1,0,1,,629637824,1
